{
  "release": true,
  "title": "摸鱼大赛规则说明",
  "clock": "2026-08-01T00:00:00Z",
  "messages": [{ "sequence": 1, "qq": "3909311212", "nickname": "Alice", "text": ".fish 规则" }],
  "expect": { "outputs": [{ "inReplyToSequence": 1, "text": "《摸鱼大赛》\n\n每个角色有脸皮厚度、摸鱼技能等级和生命值；生命值上限 = 脸皮厚度 * 2。\n每轮选择“摸鱼”或“不摸鱼”。摸鱼获得 d6 + d(摸鱼等级) 积分，目标是接近 21；达到 22 时失去生命值并随机弃牌，生命值归零后不能继续摸鱼。" }] }
}
