{
  "release": true,
  "title": "网络请求示例生成离线 URL",
  "clock": "2026-08-01T00:00:00Z",
  "messages": [{ "sequence": 1, "qq": "3909311212", "nickname": "Alice", "text": ".musicsearch 稻香" }],
  "expect": { "outputs": [{ "inReplyToSequence": 1, "text": "网络请求示例（未发送）：https://api-music.imsyy.top/cloudsearch?keywords=%E7%A8%BB%E9%A6%99" }] }
}
